<?xml version="1.0" encoding="UTF-8"?>
<diccionarioEspanol xsi:noNamespaceSchemaLocation="diccionario.xsd" xmlns:xsi="http://www.w3.org/2001/XMLSchema-instance">
	<palabra>
		<grafia>String</grafia>
		<fonetica>String</fonetica>
		<definicion>String</definicion>
		<definicion>String</definicion>
		<definicion>String</definicion>
		<fechaInsercion>1967-08-13</fechaInsercion>
		<traducciones>
			<traduccion>
				<idiomaTraduccion>String</idiomaTraduccion>
				<grafia>String</grafia>
				<fonetica>String</fonetica>
			</traduccion>
			<traduccion>
				<idiomaTraduccion>String</idiomaTraduccion>
				<grafia>String</grafia>
				<fonetica>String</fonetica>
			</traduccion>
			<traduccion>
				<idiomaTraduccion>String</idiomaTraduccion>
				<grafia>String</grafia>
				<fonetica>String</fonetica>
			</traduccion>
		</traducciones>
		<sinonimos>
			<sinonimo>
				<grafia>String</grafia>
			</sinonimo>
			<sinonimo>
				<grafia>String</grafia>
			</sinonimo>
			<sinonimo>
				<grafia>String</grafia>
			</sinonimo>
		</sinonimos>
	</palabra>
	<palabra>
		<grafia>String</grafia>
		<fonetica>String</fonetica>
		<definicion>String</definicion>
		<definicion>String</definicion>
		<definicion>String</definicion>
		<fechaInsercion>1967-08-13</fechaInsercion>
		<traducciones>
			<traduccion>
				<idiomaTraduccion>String</idiomaTraduccion>
				<grafia>String</grafia>
				<fonetica>String</fonetica>
			</traduccion>
			<traduccion>
				<idiomaTraduccion>String</idiomaTraduccion>
				<grafia>String</grafia>
				<fonetica>String</fonetica>
			</traduccion>
			<traduccion>
				<idiomaTraduccion>String</idiomaTraduccion>
				<grafia>String</grafia>
				<fonetica>String</fonetica>
			</traduccion>
		</traducciones>
		<sinonimos>
			<sinonimo>
				<grafia>String</grafia>
			</sinonimo>
			<sinonimo>
				<grafia>String</grafia>
			</sinonimo>
			<sinonimo>
				<grafia>String</grafia>
			</sinonimo>
		</sinonimos>
	</palabra>
	<palabra>
		<grafia>String</grafia>
		<fonetica>String</fonetica>
		<definicion>String</definicion>
		<definicion>String</definicion>
		<definicion>String</definicion>
		<fechaInsercion>1967-08-13</fechaInsercion>
		<traducciones>
			<traduccion>
				<idiomaTraduccion>String</idiomaTraduccion>
				<grafia>String</grafia>
				<fonetica>String</fonetica>
			</traduccion>
			<traduccion>
				<idiomaTraduccion>String</idiomaTraduccion>
				<grafia>String</grafia>
				<fonetica>String</fonetica>
			</traduccion>
			<traduccion>
				<idiomaTraduccion>String</idiomaTraduccion>
				<grafia>String</grafia>
				<fonetica>String</fonetica>
			</traduccion>
		</traducciones>
		<sinonimos>
			<sinonimo>
				<grafia>String</grafia>
			</sinonimo>
			<sinonimo>
				<grafia>String</grafia>
			</sinonimo>
			<sinonimo>
				<grafia>String</grafia>
			</sinonimo>
		</sinonimos>
	</palabra>
</diccionarioEspanol>
